<GTIN_DETAILS xmlns:xsi="http://www.w3.org/2001/XMLSchema-instance" xsi:noNamespaceSchemaLocation="gtin_v2_0.xsd">
  <!-- Generated by NHSBSA PPD on 2018/06/28 21:30:05 (and modified by gen_test_dmd_data.py) -->
  <AMPPS>
    <AMPP>
      <AMPPID>22479711000001106</AMPPID>
      <GTINDATA>
        <GTIN>5051562030603</GTIN>
        <STARTDT>2013-09-17</STARTDT>
      </GTINDATA>
    </AMPP>
    <AMPP>
      <AMPPID>22479911000001108</AMPPID>
      <GTINDATA>
        <GTIN>5051562030702</GTIN>
        <STARTDT>2013-09-17</STARTDT>
      </GTINDATA>
    </AMPP>
    <AMPP>
      <AMPPID>26352611000001103</AMPPID>
      <GTINDATA>
        <GTIN>5051562033802</GTIN>
        <STARTDT>2014-08-26</STARTDT>
      </GTINDATA>
    </AMPP>
    <AMPP>
      <AMPPID>35423511000001101</AMPPID>
      <GTINDATA>
        <GTIN>5055225061072</GTIN>
        <STARTDT>2018-05-08</STARTDT>
      </GTINDATA>
    </AMPP>
  </AMPPS>
</GTIN_DETAILS>
